{
  "intentId": "1770705584416-3702791a",
  "title": "Add intent generator tool and capability for fail-close review",
  "system": "auernyx-agent-mk2",
  "changeClass": "trunk",
  "scope": {
    "in": [
      "Python tool to scan repository and generate intent JSONs for commits missing governance intents",
      "New intentGenerator capability integrated into Auernyx system",
      "Router mapping for 'generate intent' commands",
      "Allowlist and policy updates to register new capability",
      "Documentation for fail-close review workflow"
    ],
    "out": [
      "No changes to receipt format or contract schemas",
      "No modifications to existing capability logic",
      "No changes to ledger or kintsugi integrity checks"
    ]
  },
  "riskClass": "medium",
  "governanceImpact": true,
  "actorId": "copilot-agent",
  "createdAt": "2026-02-10T06:39:44.416915+00:00",
  "status": "in_review",
  "verification": {
    "plan": "1. Run npm run compile to verify TypeScript compilation. 2. Run npm run verify to test core capabilities. 3. Test intent_generator.py with --scan and --commit flags. 4. Verify CI gate passes with exactly one intent file. 5. Confirm router maps 'generate intent' to intentGenerator capability.",
    "requiredChecks": [
      "mk2-alteration-gate",
      "compile",
      "verify"
    ]
  },
  "evidence": {
    "required": true,
    "receiptRefs": [],
    "notes": "Intent for commit ccc10df2cc7c1bea4d93ab526afe913d8c8aa84a\n\nThis change adds tooling to help review commits that failed CI due to missing intent files. The tool can scan git history, classify changes, and generate properly formatted intent JSON files.\n\nFiles modified:\n- capabilities/intentGenerator.ts (new capability)\n- config/allowlist.json (added intentGenerator)\n- core/policy.ts (added intentGenerator to CapabilityName type and metadata)\n- core/router.ts (added intent routing for 'generate intent' commands)\n- core/server.ts (registered intentGenerator in capability map)\n- tools/README.md (added documentation)\n- tools/intent_generator.py (main Python script with scan and generation logic)\n\nAdditional files:\n- docs/FAIL_CLOSE_REVIEW_WORKFLOW.md (workflow documentation)\n- tools/process_failed_runs.py (GitHub Actions integration helper)\n\nRisk mitigation: The capability is tier 1 (non-critical), requires approval, and only generates files—it does not modify existing governance data structures."
  },
  "amendments": []
}
