{
  "intentId": "1768042359024-dccfb24d",
  "title": "Copilot cleanup: satisfy mk2 alteration gate",
  "system": "auernyx-agent-mk2",
  "changeClass": "leaf",
  "scope": {
    "in": [
      "Minor code/CI cleanup to resolve Copilot/CI nags"
    ],
    "out": [
      "No contract or governance law changes"
    ]
  },
  "riskClass": "low",
  "governanceImpact": false,
  "actorId": "jhugh",
  "createdAt": "2026-01-10T10:52:46.004571Z",
  "status": "draft",
  "verification": {
    "plan": "Run mk2-alteration-gate and any relevant repo checks for the touched files.",
    "requiredChecks": [
      "mk2-alteration-gate"
    ]
  },
  "evidence": {
    "required": false,
    "receiptRefs": [],
    "notes": ""
  },
  "amendments": []
}
